{
  "artifact": {
    "byte_count": 19625755,
    "relative_path": "artifacts/cfpb/tfidf-logreg/cfpb-run-20260722T130728Z-2b7815d4c850/tfidf-logreg-pipeline-1.0.0.joblib",
    "retention": "local_only_governed_until_2026-11-19",
    "sha256": "4989984c061d368bb83e1a5e8e48e1d88189a86d7f2bb463d958a70b4dd839ff",
    "version": "tfidf-logreg-pipeline-1.0.0"
  },
  "candidates": [
    {
      "c": 0.5,
      "candidate_id": "c0p5-unweighted",
      "class_weight": null,
      "converged": true,
      "fit_seconds": 70.684,
      "n_iter": [
        15
      ],
      "validation": {
        "accuracy": 0.880322,
        "confusion_matrix": {
          "labels": [
            "Checking or savings account",
            "Credit card",
            "Credit reporting or other personal consumer reports",
            "Debt collection",
            "Debt or credit management",
            "Money transfer, virtual currency, or money service",
            "Mortgage",
            "Payday loan, title loan, personal loan, or advance loan",
            "Prepaid card",
            "Student loan",
            "Vehicle loan or lease"
          ],
          "orientation": "rows_actual_columns_predicted",
          "rows": [
            [
              4224,
              231,
              229,
              34,
              0,
              197,
              16,
              7,
              14,
              0,
              9
            ],
            [
              249,
              3940,
              814,
              133,
              0,
              34,
              2,
              4,
              14,
              2,
              3
            ],
            [
              88,
              424,
              51967,
              1183,
              3,
              9,
              125,
              31,
              0,
              58,
              124
            ],
            [
              46,
              165,
              2572,
              5848,
              0,
              8,
              50,
              27,
              1,
              5,
              62
            ],
            [
              18,
              23,
              84,
              73,
              4,
              4,
              10,
              7,
              0,
              4,
              0
            ],
            [
              493,
              73,
              68,
              10,
              0,
              1009,
              10,
              11,
              7,
              0,
              3
            ],
            [
              40,
              23,
              139,
              31,
              0,
              0,
              1784,
              17,
              0,
              1,
              1
            ],
            [
              58,
              109,
              196,
              111,
              0,
              9,
              31,
              354,
              0,
              8,
              29
            ],
            [
              100,
              64,
              22,
              7,
              0,
              24,
              0,
              0,
              235,
              0,
              0
            ],
            [
              10,
              10,
              182,
              36,
              0,
              1,
              7,
              26,
              0,
              1208,
              1
            ],
            [
              21,
              40,
              343,
              74,
              0,
              1,
              15,
              30,
              0,
              5,
              726
            ]
          ]
        },
        "macro_f1": 0.68201,
        "per_class": {
          "Checking or savings account": {
            "f1": 0.819558,
            "precision": 0.789976,
            "recall": 0.851441,
            "support": 4961
          },
          "Credit card": {
            "f1": 0.765271,
            "precision": 0.772246,
            "recall": 0.758422,
            "support": 5195
          },
          "Credit reporting or other personal consumer reports": {
            "f1": 0.939491,
            "precision": 0.917885,
            "recall": 0.962138,
            "support": 54012
          },
          "Debt collection": {
            "f1": 0.716491,
            "precision": 0.775597,
            "recall": 0.665756,
            "support": 8784
          },
          "Debt or credit management": {
            "f1": 0.034188,
            "precision": 0.571429,
            "recall": 0.017621,
            "support": 227
          },
          "Money transfer, virtual currency, or money service": {
            "f1": 0.677181,
            "precision": 0.778549,
            "recall": 0.599169,
            "support": 1684
          },
          "Mortgage": {
            "f1": 0.873226,
            "precision": 0.870244,
            "recall": 0.876228,
            "support": 2036
          },
          "Payday loan, title loan, personal loan, or advance loan": {
            "f1": 0.498943,
            "precision": 0.688716,
            "recall": 0.39116,
            "support": 905
          },
          "Prepaid card": {
            "f1": 0.650069,
            "precision": 0.867159,
            "recall": 0.519912,
            "support": 452
          },
          "Student loan": {
            "f1": 0.871573,
            "precision": 0.935709,
            "recall": 0.815665,
            "support": 1481
          },
          "Vehicle loan or lease": {
            "f1": 0.656123,
            "precision": 0.757829,
            "recall": 0.578486,
            "support": 1255
          }
        },
        "record_count": 80992,
        "weighted_f1": 0.874957,
        "worst_class_recall": 0.017621
      }
    },
    {
      "c": 1.0,
      "candidate_id": "c1p0-unweighted",
      "class_weight": null,
      "converged": true,
      "fit_seconds": 75.573,
      "n_iter": [
        15
      ],
      "validation": {
        "accuracy": 0.883692,
        "confusion_matrix": {
          "labels": [
            "Checking or savings account",
            "Credit card",
            "Credit reporting or other personal consumer reports",
            "Debt collection",
            "Debt or credit management",
            "Money transfer, virtual currency, or money service",
            "Mortgage",
            "Payday loan, title loan, personal loan, or advance loan",
            "Prepaid card",
            "Student loan",
            "Vehicle loan or lease"
          ],
          "orientation": "rows_actual_columns_predicted",
          "rows": [
            [
              4233,
              226,
              205,
              33,
              0,
              214,
              17,
              8,
              17,
              0,
              8
            ],
            [
              247,
              3970,
              769,
              139,
              0,
              37,
              3,
              9,
              14,
              3,
              4
            ],
            [
              87,
              434,
              51888,
              1221,
              3,
              8,
              129,
              45,
              1,
              63,
              133
            ],
            [
              45,
              166,
              2436,
              5967,
              0,
              9,
              52,
              36,
              1,
              5,
              67
            ],
            [
              16,
              23,
              82,
              67,
              13,
              4,
              11,
              7,
              0,
              2,
              2
            ],
            [
              457,
              67,
              57,
              12,
              0,
              1052,
              12,
              11,
              12,
              0,
              4
            ],
            [
              38,
              20,
              122,
              35,
              0,
              0,
              1800,
              17,
              0,
              1,
              3
            ],
            [
              51,
              97,
              174,
              109,
              0,
              8,
              29,
              398,
              1,
              6,
              32
            ],
            [
              83,
              60,
              21,
              7,
              0,
              29,
              0,
              0,
              252,
              0,
              0
            ],
            [
              9,
              10,
              161,
              33,
              0,
              1,
              6,
              24,
              0,
              1236,
              1
            ],
            [
              18,
              35,
              312,
              78,
              0,
              1,
              13,
              30,
              0,
              5,
              763
            ]
          ]
        },
        "macro_f1": 0.699661,
        "per_class": {
          "Checking or savings account": {
            "f1": 0.826354,
            "precision": 0.801098,
            "recall": 0.853255,
            "support": 4961
          },
          "Credit card": {
            "f1": 0.770649,
            "precision": 0.777212,
            "recall": 0.764196,
            "support": 5195
          },
          "Credit reporting or other personal consumer reports": {
            "f1": 0.941373,
            "precision": 0.922831,
            "recall": 0.960675,
            "support": 54012
          },
          "Debt collection": {
            "f1": 0.723931,
            "precision": 0.774834,
            "recall": 0.679303,
            "support": 8784
          },
          "Debt or credit management": {